{
  "$schema": "https://json-schema.org/draft/2020-12/schema",
  "$id": "https://raw.githubusercontent.com/Girish-Garg/saboot/main/contracts/schemas/scan_session.schema.json",
  "title": "scan_session",
  "description": "Body of POST /scans (decision 20261010-0203), sent after the video was PUT to the presigned URL. One Scan recording: the video in the private bucket and the GPS track captured in sync, so every frame maps to a place. The worker cuts frames from it and makes capture_mode scan reports. The video is never public and never goes to a model.",
  "type": "object",
  "additionalProperties": false,
  "required": ["scan_id", "device_token", "report_type", "context", "started_at", "ended_at", "duration_ms", "video_key", "video_sha256", "gps_track"],
  "properties": {
    "scan_id": { "type": "string", "pattern": "^scn_[a-z0-9_]{1,40}$", "description": "From POST /scans/presign; a retried POST /scans with the same id is idempotent." },
    "device_token": {
      "type": "string",
      "pattern": "^[0-9a-f]{8}-[0-9a-f]{4}-4[0-9a-f]{3}-[89ab][0-9a-f]{3}-[0-9a-f]{12}$"
    },
    "user_id": {
      "type": "string",
      "pattern": "^[A-Za-z0-9-]{1,128}$",
      "description": "Cognito sub of the signed-in user, opaque (decision 20261010-0227). The api sets it from the verified token and ignores any value the phone sends."
    },
    "report_type": { "enum": ["waste_dump", "no_bin", "contaminated_water", "open_construction", "overflowing_bin", "auto"], "description": "Picked before recording; every frame report gets it, and verification still checks it. auto is an area scout (contracts v1.10): the models name each frame's type and context, and frames they find nothing in make no report." },
    "context": { "enum": ["vacant_plot", "roadside", "drain", "other", "no_bin", "no_pickup", "stagnant", "sewage", "foam", "choked_drain", "uncovered_debris", "dusty_site", "overflowing", "damaged", "auto"], "description": "auto lets the models name the place in each frame; required with report_type auto, never allowed with no_bin." },
    "started_at": { "type": "string", "format": "date-time", "description": "When recording started; t_ms 0." },
    "ended_at": { "type": "string", "format": "date-time" },
    "duration_ms": { "type": "integer", "minimum": 1, "maximum": 60000, "description": "Video length; at most 60 s." },
    "video_key": { "type": "string", "pattern": "^scans/scn_[a-z0-9_]{1,40}\\.(webm|mp4)$", "description": "Key in the private originals bucket." },
    "video_sha256": { "type": "string", "pattern": "^[0-9a-f]{64}$", "description": "SHA-256 of the video bytes, computed on the phone, lowercase hex." },
    "gps_track": {
      "type": "array",
      "minItems": 1,
      "maxItems": 600,
      "description": "Fixes from watchPosition, at least one per second, oldest first.",
      "items": {
        "type": "object",
        "additionalProperties": false,
        "required": ["t_ms", "lat", "lon", "accuracy_m"],
        "properties": {
          "t_ms": { "type": "integer", "minimum": 0, "maximum": 60000, "description": "Time of the fix from the start of the video." },
          "lat": { "type": "number", "minimum": -90, "maximum": 90 },
          "lon": { "type": "number", "minimum": -180, "maximum": 180 },
          "accuracy_m": { "type": "number", "minimum": 0 },
          "speed_mps": { "type": ["number", "null"], "minimum": 0 },
          "heading": { "type": ["number", "null"], "minimum": 0, "maximum": 360, "description": "Degrees from true north." }
        }
      }
    },
    "hints": {
      "type": "object",
      "additionalProperties": false,
      "required": ["model", "detections"],
      "description": "On-phone detections, present only in edge mode. Hints for frame choice only; never evidence.",
      "properties": {
        "model": { "type": "string", "description": "On-phone model name and version." },
        "detections": {
          "type": "array",
          "maxItems": 600,
          "items": {
            "type": "object",
            "additionalProperties": false,
            "required": ["t_ms", "score", "box"],
            "properties": {
              "t_ms": { "type": "integer", "minimum": 0, "maximum": 60000 },
              "score": { "type": "number", "minimum": 0, "maximum": 1 },
              "box": {
                "type": "object",
                "additionalProperties": false,
                "required": ["left", "top", "width", "height"],
                "description": "Fractions of frame width and height.",
                "properties": {
                  "left": { "type": "number", "minimum": 0, "maximum": 1 },
                  "top": { "type": "number", "minimum": 0, "maximum": 1 },
                  "width": { "type": "number", "minimum": 0, "maximum": 1 },
                  "height": { "type": "number", "minimum": 0, "maximum": 1 }
                }
              }
            }
          }
        }
      }
    }
  },
  "allOf": [
    { "if": { "properties": { "report_type": { "const": "waste_dump" } } }, "then": { "properties": { "context": { "enum": ["vacant_plot", "roadside", "drain", "other", "auto"] } } } },
    { "if": { "properties": { "report_type": { "const": "no_bin" } } }, "then": { "properties": { "context": { "enum": ["no_bin", "no_pickup"] } } } },
    { "if": { "properties": { "report_type": { "const": "contaminated_water" } } }, "then": { "properties": { "context": { "enum": ["stagnant", "sewage", "foam", "choked_drain", "auto"] } } } },
    { "if": { "properties": { "report_type": { "const": "open_construction" } } }, "then": { "properties": { "context": { "enum": ["uncovered_debris", "dusty_site", "auto"] } } } },
    { "if": { "properties": { "report_type": { "const": "overflowing_bin" } } }, "then": { "properties": { "context": { "enum": ["overflowing", "damaged", "auto"] } } } },
    { "if": { "properties": { "report_type": { "const": "auto" } } }, "then": { "properties": { "context": { "const": "auto" } } } }
  ]
}
